{
  "packageLabel": "X",
  "packageSha256": "0000000000000000000000000000000000000000000000000000000000000000",
  "evaluatorWorkerId": "template-evaluator-worker-id",
  "evaluatedAt": "2026-07-20T00:00:00Z",
  "publicTests": {
    "passed": 0,
    "failed": 0,
    "command": "npm run test:public",
    "exitCode": 0,
    "rawOutputSha256": "0000000000000000000000000000000000000000000000000000000000000000"
  },
  "hiddenTests": {
    "passed": 0,
    "failed": 0,
    "command": "sealed-hidden-suite-command-required-at-run",
    "exitCode": 0,
    "rawOutputSha256": "0000000000000000000000000000000000000000000000000000000000000000"
  },
  "items": [
    {
      "id": "A1",
      "score": 0,
      "maximum": 6,
      "evidence": [],
      "rationale": "UNSCORED"
    },
    {
      "id": "A2",
      "score": 0,
      "maximum": 8,
      "evidence": [],
      "rationale": "UNSCORED"
    },
    {
      "id": "A3",
      "score": 0,
      "maximum": 10,
      "evidence": [],
      "rationale": "UNSCORED"
    },
    {
      "id": "A4",
      "score": 0,
      "maximum": 10,
      "evidence": [],
      "rationale": "UNSCORED"
    },
    {
      "id": "A5",
      "score": 0,
      "maximum": 7,
      "evidence": [],
      "rationale": "UNSCORED"
    },
    {
      "id": "A6",
      "score": 0,
      "maximum": 7,
      "evidence": [],
      "rationale": "UNSCORED"
    },
    {
      "id": "A7",
      "score": 0,
      "maximum": 2,
      "evidence": [],
      "rationale": "UNSCORED"
    },
    {
      "id": "B1",
      "score": 0,
      "maximum": 5,
      "evidence": [],
      "rationale": "UNSCORED"
    },
    {
      "id": "B2",
      "score": 0,
      "maximum": 5,
      "evidence": [],
      "rationale": "UNSCORED"
    },
    {
      "id": "B3",
      "score": 0,
      "maximum": 5,
      "evidence": [],
      "rationale": "UNSCORED"
    },
    {
      "id": "C1",
      "score": 0,
      "maximum": 6,
      "evidence": [],
      "rationale": "UNSCORED"
    },
    {
      "id": "C2",
      "score": 0,
      "maximum": 4,
      "evidence": [],
      "rationale": "UNSCORED"
    },
    {
      "id": "C3",
      "score": 0,
      "maximum": 5,
      "evidence": [],
      "rationale": "UNSCORED"
    },
    {
      "id": "D1",
      "score": 0,
      "maximum": 4,
      "evidence": [],
      "rationale": "UNSCORED"
    },
    {
      "id": "D2",
      "score": 0,
      "maximum": 4,
      "evidence": [],
      "rationale": "UNSCORED"
    },
    {
      "id": "D3",
      "score": 0,
      "maximum": 2,
      "evidence": [],
      "rationale": "UNSCORED"
    },
    {
      "id": "E1",
      "score": 0,
      "maximum": 3,
      "evidence": [],
      "rationale": "UNSCORED"
    },
    {
      "id": "E2",
      "score": 0,
      "maximum": 3,
      "evidence": [],
      "rationale": "UNSCORED"
    },
    {
      "id": "E3",
      "score": 0,
      "maximum": 2,
      "evidence": [],
      "rationale": "UNSCORED"
    },
    {
      "id": "E4",
      "score": 0,
      "maximum": 2,
      "evidence": [],
      "rationale": "UNSCORED"
    }
  ],
  "sectionTotals": {
    "functional": 0,
    "robustnessSecurity": 0,
    "accessibilityUsability": 0,
    "testEffectiveness": 0,
    "maintainabilityDocs": 0
  },
  "uncappedTotal": 0,
  "capConditions": {
    "buildFailedOrCannotRender": false,
    "defaultAllow": false,
    "executableInjectionOrUnexpectedNetwork": false
  },
  "capsApplied": [],
  "finalTotal": 0,
  "uncertainties": [],
  "evidenceHash": "0000000000000000000000000000000000000000000000000000000000000000"
}
